Task ID,Task Name,Description,Category,Status,Priority,Assignee,Start Date,Due Date,Dependencies
PHASE-1,PHASE 1: REQUIREMENTS ANALYSIS AND PLANNING,4 WEEKS duration,Planning,Not Started,High,Project Manager,2025-05-01,2025-05-28,
RA-001,Market Analysis,Conduct market analysis and competitor research,Research,Not Started,High,Product Manager,2025-05-01,2025-05-14,
RA-002,Feature Requirements Documentation,Document all feature requirements,Documentation,Not Started,High,Product Manager,2025-05-01,2025-05-21,
RA-003,Technical Specification Development,Develop technical specifications,Documentation,Not Started,High,Tech Lead,2025-05-08,2025-05-21,RA-002
RA-004,Project Planning,Create project plan and timeline,Planning,Not Started,High,Project Manager,2025-05-15,2025-05-28,RA-002
RA-005,Resource Allocation,Allocate resources for the project,Planning,Not Started,Medium,Project Manager,2025-05-15,2025-05-28,RA-004
RA-006,Risk Assessment,Identify and document potential risks,Planning,Not Started,Medium,Project Manager,2025-05-15,2025-05-28,
RA-007,Risk Mitigation Planning,Develop risk mitigation strategies,Planning,Not Started,Medium,Project Manager,2025-05-22,2025-05-28,RA-006
RA-008,Finalize Feature List,Complete and approve final feature list,Planning,Not Started,High,Product Manager,2025-05-22,2025-05-28,RA-002
RA-009,Initial Architecture Design,Develop initial architectural design,Design,Not Started,High,Tech Lead,2025-05-15,2025-05-28,RA-003
PHASE-2,PHASE 2: SYSTEM DESIGN,6 WEEKS duration,Design,Not Started,High,Tech Lead,2025-05-29,2025-07-09,PHASE-1
SD-001,Architecture Design,Create detailed system architecture design,Design,Not Started,High,Tech Lead,2025-05-29,2025-06-12,RA-009
SD-002,Architecture Documentation,Document the system architecture,Documentation,Not Started,High,Tech Lead,2025-06-06,2025-06-19,SD-001
SD-003,Database Schema Design,Design database schema,Design,Not Started,High,Database Engineer,2025-05-29,2025-06-19,RA-009
SD-004,UI/UX Wireframing,Create wireframes for all major screens,Design,Not Started,High,UI/UX Designer,2025-05-29,2025-06-19,RA-008
SD-005,UI/UX Prototyping,Develop interactive prototypes,Design,Not Started,High,UI/UX Designer,2025-06-13,2025-07-02,SD-004
SD-006,API Design,Design API endpoints and documentation,Design,Not Started,High,Backend Developer,2025-06-06,2025-06-26,SD-001
SD-007,Security Architecture Planning,Plan security architecture,Security,Not Started,High,Security Engineer,2025-06-13,2025-07-02,SD-001
SD-008,Development Environment Setup,Set up development environment,DevOps,Not Started,Medium,DevOps Engineer,2025-06-27,2025-07-09,SD-001
PHASE-3,PHASE 3: IMPLEMENTATION,14 WEEKS duration,Development,Not Started,High,Tech Lead,2025-07-10,2025-10-15,PHASE-2
PHASE-3.1,Core Features Implementation,Implementation of core features,Development,Not Started,High,Tech Lead,2025-07-10,2025-08-28,PHASE-2
IM-001,Frontend Setup,Set up React.js with TypeScript project structure,Development,Not Started,High,Frontend Developer,2025-07-10,2025-07-16,SD-005
IM-002,State Management Setup,Implement Redux Toolkit for state management,Development,Not Started,High,Frontend Developer,2025-07-10,2025-07-23,IM-001
IM-003,Styling Framework Setup,Set up Tailwind CSS and Headless UI,Development,Not Started,Medium,Frontend Developer,2025-07-10,2025-07-23,IM-001
IM-004,User Authentication System,"Implement user authentication with Auth0",Development,Not Started,High,Backend Developer,2025-07-10,2025-07-30,SD-006
IM-005,Database Implementation,Set up Supabase database according to schema,Development,Not Started,High,Database Engineer,2025-07-10,2025-07-30,SD-003
IM-006,Core UI Components,Develop reusable UI components,Development,Not Started,High,Frontend Developer,2025-07-17,2025-08-07,IM-003
IM-007,Color Palette Generator,Implement core palette generation feature,Development,Not Started,High,Frontend Developer,2025-07-24,2025-08-21,IM-006
IM-008,Color Manipulation Tools,"Implement color adjustment tools",Development,Not Started,High,Frontend Developer,2025-07-31,2025-08-28,IM-007
IM-009,Database Integration,Integrate frontend with database,Development,Not Started,High,Full Stack Developer,2025-07-24,2025-08-14,IM-005
PHASE-3.2,Advanced Features Implementation,Implementation of advanced features,Development,Not Started,High,Tech Lead,2025-08-29,2025-10-15,PHASE-3.1
IM-010,Palette Management Features,"Implement save, edit, delete functionality",Development,Not Started,High,Full Stack Developer,2025-08-29,2025-09-11,IM-009
IM-011,Export Functionality,"Implement various export options",Development,Not Started,Medium,Frontend Developer,2025-08-29,2025-09-18,IM-007
IM-012,Community Features,"Implement like, comment, follow features",Development,Not Started,Medium,Full Stack Developer,2025-09-05,2025-09-25,IM-010
IM-013,API Endpoints,Develop RESTful API endpoints,Development,Not Started,High,Backend Developer,2025-09-12,2025-10-01,IM-009
IM-014,Color Tools Implementation,"Implement color blindness simulator and contrast checker",Development,Not Started,Medium,Frontend Developer,2025-09-12,2025-10-01,IM-008
IM-015,Exploration Tools,"Implement browse and filter functionality",Development,Not Started,Medium,Frontend Developer,2025-09-26,2025-10-15,IM-012
IM-016,Integration Features,"Implement image color extraction",Development,Not Started,Low,Full Stack Developer,2025-10-02,2025-10-15,IM-011
PHASE-3.3,Testing Implementation,Implementation of testing,Testing,Not Started,High,QA Engineer,2025-07-17,2025-11-06,PHASE-3.1
IM-017,Unit Testing Setup,Set up Jest for JavaScript/TypeScript,Testing,Not Started,High,QA Engineer,2025-07-17,2025-07-23,IM-001
IM-018,Component Testing,"Implement React Testing Library tests",Testing,Not Started,High,Frontend Developer,2025-07-24,2025-08-14,IM-006
IM-019,API Testing,"Implement API endpoint tests",Testing,Not Started,High,Backend Developer,2025-09-19,2025-10-08,IM-013
IM-020,Integration Tests,Develop integration tests,Testing,Not Started,High,QA Engineer,2025-10-09,2025-11-06,IM-015
PHASE-4,PHASE 4: TESTING,4 WEEKS duration,Testing,Not Started,High,QA Engineer,2025-10-16,2025-11-13,PHASE-3
TS-001,System Testing,Conduct end-to-end system testing,Testing,Not Started,High,QA Engineer,2025-10-16,2025-10-29,IM-020
TS-002,Performance Testing,Test application performance and optimization,Testing,Not Started,High,Performance Engineer,2025-10-23,2025-11-06,TS-001
TS-003,Security Testing,Conduct security vulnerability testing,Testing,Not Started,High,Security Engineer,2025-10-23,2025-11-06,TS-001
TS-004,Accessibility Testing,Test for WCAG compliance,Testing,Not Started,High,Accessibility Specialist,2025-10-30,2025-11-13,TS-001
TS-005,Bug Fixing and Refinement,Fix identified issues and refine features,Development,Not Started,High,Development Team,2025-10-16,2025-11-13,TS-001
TS-006,Final System Testing,Conduct final system testing after fixes,Testing,Not Started,High,QA Engineer,2025-11-14,2025-11-27,TS-005
PHASE-5,PHASE 5: DEPLOYMENT,2 WEEKS duration,Deployment,Not Started,High,DevOps Engineer,2025-11-14,2025-12-10,PHASE-4
DP-001,CI/CD Pipeline Setup,"Set up continuous integration and deployment pipeline",DevOps,Not Started,High,DevOps Engineer,2025-11-14,2025-11-27,TS-006
DP-002,Staging Environment Deployment,Deploy application to staging environment,DevOps,Not Started,High,DevOps Engineer,2025-11-21,2025-11-27,DP-001
DP-003,Production Environment Preparation,Prepare production environment,DevOps,Not Started,High,DevOps Engineer,2025-11-21,2025-12-03,DP-002
DP-004,Documentation Finalization,Complete all documentation,Documentation,Not Started,Medium,Technical Writer,2025-11-14,2025-12-03,TS-006
DP-005,Deployment Checklist Verification,Verify all deployment requirements,DevOps,Not Started,High,Project Manager,2025-11-28,2025-12-03,DP-003
DP-006,Soft Launch,Conduct beta testing with limited users,Deployment,Not Started,High,Project Manager,2025-11-28,2025-12-10,DP-005
DP-007,Performance Monitoring Setup,Set up monitoring and alerting,DevOps,Not Started,Medium,DevOps Engineer,2025-11-28,2025-12-10,DP-003
DELIV-1,DOCUMENTATION DELIVERABLES,Documentation deliverables,Documentation,Not Started,High,Technical Writer,2025-05-08,2025-12-03,
DOC-001,Project Requirements Document,Create comprehensive project requirements document,Documentation,Not Started,High,Product Manager,2025-05-08,2025-05-28,RA-002
DOC-002,Technical Architecture Documentation,Document technical architecture,Documentation,Not Started,High,Tech Lead,2025-06-13,2025-07-02,SD-002
DOC-003,API Documentation,Create API documentation,Documentation,Not Started,High,Backend Developer,2025-09-26,2025-10-15,IM-013
DOC-004,User Guide,Create user guide and help documentation,Documentation,Not Started,Medium,Technical Writer,2025-10-30,2025-11-27,TS-001
DOC-005,Accessibility Compliance Documentation,Document accessibility compliance,Documentation,Not Started,Medium,Accessibility Specialist,2025-11-07,2025-11-27,TS-004
DOC-006,Development Standards Document,Create development standards document,Documentation,Not Started,Medium,Tech Lead,2025-06-20,2025-07-09,SD-002
DOC-007,Testing Strategy Document,Create testing strategy document,Documentation,Not Started,Medium,QA Engineer,2025-07-17,2025-07-30,IM-017
DOC-008,Deployment Procedure Documentation,Document deployment procedures,Documentation,Not Started,Medium,DevOps Engineer,2025-11-21,2025-12-03,DP-002
DELIV-2,DESIGN DELIVERABLES,Design deliverables,Design,Not Started,High,UI/UX Designer,2025-06-06,2025-07-16,
DES-001,Brand Identity Guidelines,Create brand identity guidelines,Design,Not Started,Medium,UI/UX Designer,2025-06-06,2025-06-26,SD-004
DES-002,UI Component Library,Develop UI component library,Design,Not Started,High,UI/UX Designer,2025-06-20,2025-07-16,SD-005
DES-003,Wireframes,Create wireframes for all major screens,Design,Not Started,High,UI/UX Designer,2025-05-29,2025-06-19,SD-004
DES-004,Interactive Prototypes,Develop interactive prototypes,Design,Not Started,High,UI/UX Designer,2025-06-13,2025-07-02,DES-003
DES-005,Responsive Design Specifications,Create responsive design specifications,Design,Not Started,High,UI/UX Designer,2025-06-20,2025-07-09,DES-003
DES-006,Animation and Transition Specifications,Document animation and transition specifications,Design,Not Started,Low,UI/UX Designer,2025-06-27,2025-07-16,DES-004
DES-007,Accessibility Design Guidelines,Create accessibility design guidelines,Design,Not Started,High,Accessibility Specialist,2025-06-20,2025-07-09,DES-003
DES-008,Color System Documentation,Document color system,Design,Not Started,Medium,UI/UX Designer,2025-06-13,2025-07-02,DES-001
DELIV-3,DEVELOPMENT DELIVERABLES,Development deliverables,Development,Not Started,High,Tech Lead,2025-07-03,2025-11-13,
DEV-001,Version-controlled Codebase,Set up Git repository and workflow,DevOps,Not Started,High,DevOps Engineer,2025-07-03,2025-07-16,SD-008
DEV-002,Frontend Application,Develop complete frontend application,Development,Not Started,High,Frontend Developer,2025-07-10,2025-10-15,IM-001
DEV-003,Serverless Functions,"Implement serverless functions",Development,Not Started,High,Backend Developer,2025-07-17,2025-10-08,IM-004
DEV-004,Database Schema and Migrations,"Implement database schema and migrations",Development,Not Started,High,Database Engineer,2025-07-10,2025-07-30,SD-003
DEV-005,API Implementation,"Implement complete API",Development,Not Started,High,Backend Developer,2025-09-12,2025-10-15,IM-013
DEV-006,Authentication System,"Implement authentication system",Development,Not Started,High,Backend Developer,2025-07-10,2025-07-30,SD-006
DEV-007,Unit and Integration Tests,"Develop comprehensive test suite",Testing,Not Started,High,QA Engineer,2025-07-17,2025-11-13,IM-017
DEV-008,Build and Deployment Pipelines,Set up build and deployment pipelines,DevOps,Not Started,High,DevOps Engineer,2025-11-07,2025-11-27,TS-006
DELIV-4,DEPLOYMENT DELIVERABLES,Deployment deliverables,Deployment,Not Started,High,DevOps Engineer,2025-06-27,2025-12-10,
DPL-001,Production Environment,Set up production environment,DevOps,Not Started,High,DevOps Engineer,2025-11-21,2025-12-03,DP-003
DPL-002,Staging Environment,Set up staging environment,DevOps,Not Started,High,DevOps Engineer,2025-11-14,2025-11-27,DP-001
DPL-003,Development Environment,Set up development environment,DevOps,Not Started,High,DevOps Engineer,2025-06-27,2025-07-09,SD-008
DPL-004,Continuous Integration Pipeline,Set up CI pipeline,DevOps,Not Started,High,DevOps Engineer,2025-11-07,2025-11-20,TS-006
DPL-005,Continuous Deployment Pipeline,Set up CD pipeline,DevOps,Not Started,High,DevOps Engineer,2025-11-14,2025-11-27,DPL-004
DPL-006,Monitoring and Alerting Setup,Set up monitoring and alerting,DevOps,Not Started,Medium,DevOps Engineer,2025-11-28,2025-12-10,DP-007
DPL-007,Backup and Restore Procedures,"Document and implement backup procedures",DevOps,Not Started,Medium,DevOps Engineer,2025-11-21,2025-12-03,DPL-001
DPL-008,Disaster Recovery Plan,"Create disaster recovery plan",DevOps,Not Started,Medium,DevOps Engineer,2025-11-21,2025-12-03,DPL-001